"name","url","description"
"SARRACENIACEAE (SARRACENIA/PITCHER PLANT) 0.5 MG/ML, INJECTABLE SOLUTION, 100ML","https://nexgenvetrx.com/sarraceniaceae-sarracenia-pitcher-plant-0-5-mg-ml-injectable-solution-100ml/","Muscle discomfort and pain as a cause of lameness and poor performance in the horse is often poorly recognized. While human athletes are readily ably to convey discomfort and pain to physicians, this is obviously not the case with horses, whose muscle injuries often go documented as a cause of lameness. Lameness in the horse is usually characterized by the resulting gait abnormalities.1 Other muscle problems (stress tetany, synchronous diaphragmatic flutter, exhaustion, post exercise fatigue,..."
"TOLAZOLINE HCL 100 MG/ML, INJECTABLE SOLUTION, 100ML","https://nexgenvetrx.com/tolazoline-hcl-100-mg-ml-injectable-solution-100ml/","Tolazoline HCl belongs to the synthetic group of α-adrenergic blocking agents known as the imidazoline derivatives. It will reverse the analgesic effects of α-agonists. Tolazoline antagonizes the effects of detomidine more completely, hastens recovery, and lasts longer than atipamezole.1 Tolazoline is a vasodilator that has direct actions on blood vessels and also increases cardiac output. It can interact to some degree with histamine, adrenergic, and cholinergic receptors, but the mechanisms..."
"MIDAZOLAM HCL 50 MG/ML, INJECTABLE SOLUTION, 10ML","https://nexgenvetrx.com/midazolam-hcl-50-mg-ml-injectable-solution-10ml/","FOR RX ONLY: A valid prescription from a licensed veterinarian is required for dispensing this medication."
"ISOFLUPREDONE ACETATE 2 MG/ML, INJECTABLE SUSPENSION, 100ML","https://nexgenvetrx.com/isoflupredone-acetate-2-mg-ml-injectable-suspension-100ml/","Heaves is a common, allergic respiratory disease of horses characterized by chronic cough, nasal discharge and respiratory difficulty. It is also known as Recurrent Airway Obstruction (RAO), Chronic Obstructive Pulmonary Disease (COPD) broken wind and emphysema. Heaves in horses is most analogous to asthma in humans. Episodes are usually observed when a horse is stabled, bedded on straw and fed hay.1 In most cases, eliminating these factors can result in a reduction of clinical signs. Most..."
"N-BUTYLSCOPOLAMMONIUM BROMIDE 40 MG/ML, INJECTABLE SOLUTION, 50ML","https://nexgenvetrx.com/n-butylscopolammonium-bromide-40-mg-ml-injectable-solution-50ml/","“Colic” generally references pain in the abdomen. Gas colic—sometimes referred to as “spasmodic colic”—is mild to moderate abdominal pain in horses that can resolve on its own or with a single treatment, as opposed to being a symptom of a more serious ailment. Gas buildup within a horse’s digestive tract is thought to be one of the most common causes of colic.1 Colic can occur at any time of year, frequently arises in the spring, when a horse ingests forage that is high in sugar, such as spring..."
"KETOPROFEN 100 MG/ML + ACETYL-D-GLUCOSAMINE 100 MG/ML + ARGININE (L) 105 MG/ML, INJECTABLE SOLUTION, 100ML","https://nexgenvetrx.com/ketoprofen-100-mg-ml-acetyl-d-glucosamine-100-mg-ml-arginine-l-105-mg-ml-injectable-solution-100ml/","Ketoprofen is an FDA approved, nonsteroidal anti-inflammatory drug (NSAID) that works by inhibiting the body's production of prostaglandins and other chemicals that stimulate the body's inflammatory response. Ketoprofen can make horses more comfortable while recuperating from infections and diseases characterized by musculoskeletal-related pain and inflammation. Glucosamine has been given for the treatment osteoarthritis and is proving to be one of the safest and best treatments for the..."
"VITAMIN B-12 5000 MCG STERILE SOLUTION INJECTION, 100ML","https://nexgenvetrx.com/vitamin-b-12-5000-mcg-sterile-solution-injection-100ml/","FOR RX ONLY: A valid prescription from a licensed veterinarian is required for dispensing this medication."
"MKB2™ (MEDETOMIDINE HCL 20 MG/ML + KETAMINE HCL 100 MG/ML + BUTORPHANOL TARTRATE 50 MG/ML), INJECTABLE SOLUTION, 10ML","https://nexgenvetrx.com/mkb2-medetomidine-hcl-20-mg-ml-ketamine-hcl-100-mg-ml-butorphanol-tartrate-50-mg-ml-injectable-solution-10ml/","Information gained from the capture and handling of free-ranging animals helps advance the understanding of wildlife ecology and aids in crafting wildlife management policy. Unfortunately, animals can experience increased levels of stress, injuries, and death resulting from captures.1 Fortunately, some of the above information has also helped immeasurably in the development of drug formulations that actually decrease the risks associated with capture and chemical immobilization. Since the..."
"DEXAMETHASONE SODIUM PHOSPHATE 24 MG/ML, INJECTABLE SOLUTION, 100ML","https://nexgenvetrx.com/dexamethasone-sodium-phosphate-24-mg-ml-injectable-solution-100ml/","Although glucocorticoids have been used to treat many conditions in humans and animals, dexamethasone has five primary uses with accompanying dosage ranges: 1) as a diagnostic agent to test for hyperadrenocorticism, 2) as a replacement or supplementation for glucocorticoid deficiency secondary to hypoadrenocorticism, 3) as an anti-inflammatory agent, 4) for immunosuppression, and 5) as an antineoplastic agent.2,3 NOTE per dexamethasone use in horses: The Association of Racing Commissioners..."
"OXYTOCIN INJECTION, PURIFIED OXYTOCIC PRINCIPLE, STERILE AQUEOUS SOLUTION, 100ML","https://nexgenvetrx.com/oxytocin-injection-purified-oxytocic-principle-sterile-aqueous-solution-100ml/","FOR RX ONLY: A valid prescription from a licensed veterinarian is required for dispensing this medication."
"PROGESTERONE 150 MG/ML + ALTRENOGEST 18 MG/ML, INJECTION, 100ML","https://nexgenvetrx.com/progesterone-150-mg-ml-altrenogest-18-mg-ml-injection-100ml/","Progesterone + Altrenogest During the ovulatory season, healthy mares cycle normally and exhibit sexual receptivity to the stallion on a regular basis; they are also producing normal follicles that ovulate. The ovulatory season begins in middle of Spring (early April) and continues through the Fall unless the mare becomes pregnant. The mare undergoes a succession of cycles, with each being around 22 days in length. The equine estrous cycle is divided into two parts: estrus and diestrus. Estrus..."
"B-QUIET (TRYPTOPHAN + MAGNESIUM CHLORIDE + THIAMINE + CALCIUM LEVULINATE), INJECTABLE SOLUTION, 100ML","https://nexgenvetrx.com/b-quiet-tryptophan-magnesium-chloride-thiamine-calcium-levulinate-injectable-solution-100ml/","Excitability in horses references a type or types of unpredictable, undesirable agitation displayed by a horse.1 Typically, it does not refer to the energy level or stamina of the horse itself. This is an important difference to note, because every horse has its own temperament, and some horses and certain breeds are naturally more energetic than others. This doesn’t necessarily mean that they are excitable. For example, a Thoroughbred and a Quarter Horse have different energy levels and..."
"METHOCARBAMOL 100 MG/ML + SODIUM HYALURONATE 1 MG/ML, INJECTABLE SOLUTION, 100ML","https://nexgenvetrx.com/methocarbamol-100-mg-ml-sodium-hyaluronate-1-mg-ml-injectable-solution-100ml/","Methocarbamol is widely used as a muscle relaxant in dogs, cats and horses. Methocarbamol has been proven effective in a wide range of disorders involving acute muscle spasm. In horses, Methocarbamol is typically used for various conditions including muscle soreness, trauma, bursitis, muscle and ligament damage, and other conditions that cause painful muscle spasms, including surgery. Hyaluronic Acid is used as a Joint Supplement for horses. Methocarbamol 100 mg/ml / Hyaluronic Acid 1 mg/ml by..."
"METABOLITE VITAMIN COMBO (VITAMIN B12, DEXTROSE, AMINO ACIDS, ELECTROLYTES), INJECTABLE SOLUTION, 500ML","https://nexgenvetrx.com/metabolite-vitamin-combo-vitamin-b12-dextrose-amino-acids-electrolytes-injectable-solution-500ml/","Vitamins are organic compounds that horses require in relatively small amounts. There are two types of vitamins—fat soluble vitamins and water soluble vitamins. The National Research Council’s (NRC) Nutrient Requirement of Horseslists estimates of daily needs for several essential vitamins. Since vitamins play such a large role in normal metabolism however, supplementing vitamins over NRC estimates can be advantageous in certain cases. Vitamin B12 is a water-soluble vitamin which has important..."
"DETOMIDINE HCL 10 MG/ML + XYLAZINE HCL 50 MG/ML, INJECTABLE SOLUTION, 30ML","https://nexgenvetrx.com/detomidine-hcl-10-mg-ml-xylazine-hcl-50-mg-ml-injectable-solution-30ml/","Although the majority of sedative and analgesic drugs used for the restraint of equines are labeled for use as sole agents, most equine veterinarians use these medications in combination with the goal of optimizing the onset, quality, and duration of the alteration in mental state while minimizing potentially deleterious side effects.1 There are many medical and even surgical procedures that can be performed on standing horses, assuming that the requisite chemical restraint and analgesia are..."
"DETOMIDINE HCL 2 MG/ML + N-BUTYLSCOPOLAMMONIUM BROMIDE 20 MG/ML, INJECTABLE SOLUTION, 50ML","https://nexgenvetrx.com/detomidine-hcl-2-mg-ml-n-butylscopolammonium-bromide-20-mg-ml-injectable-solution-50ml/","Abdominal pain can be a key indicator of a variety of gastrointestinal maladies in the horse. Diarrhea and weight loss accompanied by abdominal pain can be caused by many different disorders, including infectious diseases, parasites, inflammation, tumors, reactions to poisons or drugs, stress, changes in diet or colic.1 Horses with certain types of colic may or may not require surgery (e.g., cases of intestinal obstruction). The treatment modality is best determined depending upon the cause of..."
"DETOMIDINE HCL 2.5 MG/ML + XYLAZINE HCL 100 MG/ML, INJECTABLE SOLUTION, 30ML","https://nexgenvetrx.com/detomidine-hcl-2-5-mg-ml-xylazine-hcl-100-mg-ml-injectable-solution-30ml/","Many surgical and diagnostic procedures can be accomplished in standing horses if appropriate combinations of physical and chemical restraint are employed. The ability to perform procedures in the standing position is more important in the horse than in other species because of the greater risk of complications associated with anesthesia in equine species.1 This is of increased concern in the case of procedures in mature horses. There are numerous drugs approved for use in horses for standing..."
"NOTIEUP (POTASSIUM CHLORIDE + MAGNESIUM CHLORIDE + NIACIN + ARGININE HCL + L-LYSINE HCL + CYANOCOBALAMIN), INJECTABLE SOLUTION, 100ML","https://nexgenvetrx.com/notieup-potassium-chloride-magnesium-chloride-niacin-arginine-hcl-l-lysine-hcl-cyanocobalamin-injectable-solution-100ml/",""
"EXCEDE (CEFTIOFUR CRYSTALLINE FREE ACID) STERILE SUSPENSION FOR CATTLE AND EQUINE, 100ML","https://nexgenvetrx.com/excede-ceftiofur-crystalline-free-acid-sterile-suspension-for-cattle-and-equine-100ml/","Excede (Ceftiofur Crystalline Free Acid) Sterile Suspension for Cattle and Equine, 100mL: Advanced Veterinary Antibiotic Solution Revolutionary Treatment for Livestock Health Excede Sterile Suspension is a breakthrough in the field of veterinary antibiotics, offering a robust solution for the health management of both cattle and equine. This advanced formula, presented in a convenient 100mL packaging, is designed for effective and efficient treatment, ensuring the well-being of your livestock...."
"BLEEDER STOP VITAMIN COMBO (VITAMIN C + L-HISTIDINE + L-ARGININE + L-LYSINE + VITAMIN B-6), INJECTABLE SOLUTION, 100ML","https://nexgenvetrx.com/bleeder-stop-vitamin-combo-vitamin-c-l-histidine-l-arginine-l-lysine-vitamin-b-6-injectable-solution-100ml/","The term “bleeder” is typically attributed to horses which present with blood through the nostrils following a race or other activity involving heavy exertion. Bleeding can occur during or after exertion, and can take weeks to resolve in some horses.1 This condition is known as exercise-induced pulmonary hemorrhage (EIPH), or bleeding from the lungs. This occurs often in performance horses and is a significant cause of exercise intolerance. EIPH occurs primarily in Quarter Horses, Standardbreds..."
"MKBM™ (MEDETOMIDINE HCL 20 MG/ML + KETAMINE HCL 100 MG/ML + BUTORPHANOL TARTRATE 30 MG/ML + MIDAZOLAM HCL 20 MG/ML), INJECTABLE SOLUTION, 10ML","https://nexgenvetrx.com/mkbm-medetomidine-hcl-20-mg-ml-ketamine-hcl-100-mg-ml-butorphanol-tartrate-30-mg-ml-midazolam-hcl-20-mg-ml-injectable-solution-10ml/","Wildlife practice is a specialized area of veterinary medicine, particularly in the realm of large and exotic hoofstock. Restraining individual animals of these species nearly always requires the use of anesthetic drugs to provide safe, effective immobilization before veterinarians and/or wildlife managers engage in any number of invasive or noninvasive procedures.1,2 Thus, anesthesia plays a critical role in wildlife veterinary medicine. Relocation and other management procedures, preventive..."
"EXCEDE FOR CATTLE & HORSES, 250ML","https://nexgenvetrx.com/excede-for-cattle-horses-250ml/","The usual dosage for cattle is 1.5 ml per 100 lbs body weight, given by SQ injection. Horses usually receive 2 doses, 4 days apart, at the rate of 1.5 ml per 100 lbs body weight, given by intramuscular (IM) injection. FOR RX ONLY: A valid prescription from a licensed veterinarian is required for dispensing this medication."
"MKB™ KIT (SEDATION & REVERSAL)","https://nexgenvetrx.com/mkb-kit-sedation-reversal/","Butorphanol tartrate is a synthetically derived opioid agonist-antagonist analgesic of the phenanthrene series, with a potency of about four to seven times that of morphine. In combination with medetomidine HCL (10 MG/ML) and ketamine HCL (50 MG/ML), the three provide a safe and gentler induction and excellent recovery results. By using the MKB™ kit from NexGen Pharmaceuticals, wildlife handlers are able to induce a reversible sedation, with inductions times ranging from 3 to 5 minutes and..."
"MK KIT (SEDATION & REVERSAL)","https://nexgenvetrx.com/mk-kit-sedation-reversal/","The chemical immobilization of wildlife species is a form of veterinary anesthesia conducted under difficult circumstances.1 Anesthesia plays an important role in wildlife veterinary medicine, since the majority of the procedures carried out involve chemical restraint techniques.1 Veterinarians in wildlife medicine must administer anesthetic drugs effectively, using varied delivery systems. There are different approaches to administering drugs in chemical restraint procedures: oral, hand-held..."
"MK2™ KIT (SEDATION & REVERSAL)","https://nexgenvetrx.com/mk2-kit-sedation-reversal/","Anesthesia plays an important role in wildlife veterinary medicine, since the majority of the procedures carried out on wildlife species involve chemical restraint techniques.1 The ideal immobilization drug formulations for wild and exotic animals will have a wide safety margin, small volume for delivery, and will be fully reversible; thus, a small volume will facilitate rapid administration especially if remote delivery systems are used.1,2 Additionally, more concentrated anesthetics result in..."
"MKB2™ KIT (SEDATION & REVERSAL)","https://nexgenvetrx.com/mkb2-kit-sedation-reversal/","While the information gained from the capture and handling of free-ranging animals has been invaluable in advancing the understanding of wildlife ecology and aids in crafting wildlife management policy, it also exposes animals to increased levels of stress, injuries, and death resulting from captures.1 Fortunately, this information has also helped in the development of drug formulations that actually decrease the risks associated with capture and chemical immobilization. In most cases,..."
"MKM™ KIT (SEDATION & REVERSAL)","https://nexgenvetrx.com/mkm-kit-sedation-reversal/","Many procedures that are routinely accomplished in domestic animals with minimal restraint require anesthesia for the welfare and safety of the zoo animal, as well as the veterinarian and support personnel. As such, the chemical immobilization of exotic animals in the zoo setting is a form of veterinary anesthesia conducted under substantially more difficult circumstances than in a practice setting.1 Although physiological responses during the maintenance of anesthesia are generally not..."
"GUAIFENESIN 50 MG/ML + DEXTROSE 50 MG/ML, STERILE SOLUTION, 500ML","https://nexgenvetrx.com/guaifenesin-50-mg-ml-dextrose-50-mg-ml-sterile-solution-500ml/","Guaifenesin 50 MG/ML / Dextrose Sterile Solution 50 MG/ML Most equine veterinarians perform short-duration anesthesia frequently, but only 10% anesthetize horses for greater than 30 minutes on a regular basis. Approximately 50% of equine veterinarians anesthetizing horses for greater than 30 minutes use inhalants for maintenance of anesthesia, with the balance using repeated injections of induction drugs. Approximately 87% of equine veterinarians anesthetizing horses for greater than 30 minutes..."
"TICARCILLIN DISODIUM + CLAVULANATE POTASSIUM 3.1 GM, FOR RECONSTITUTION, 50ML (STERILE FILTER INCLUDED)","https://nexgenvetrx.com/ticarcillin-disodium-clavulanate-potassium-3-1-gm-for-reconstitution-50ml-sterile-filter-included/","Ticarcillin For Equines Ticarcillin is a carboxypenicillin that is typically used in combination with clavulanate (the β-lactamase inhibitor clavulanate potassium, or the potassium salt of clavulanic acid) as ticarcillin/clavulanic acid. Ticarcillin is a form of penicillin which falls within the class of beta-lactam antibiotics. Its main clinical use is as an injectable antibiotic for the treatment of gram-negative bacteria. Ticarcillin has often been used in the intrauterine treatment of..."
"TRICHLORMETHIAZIDE 200 MG/10ML + DEXAMETHASONE 5 MG/10ML, ORAL PASTE, 30ML SYRINGE","https://nexgenvetrx.com/trichlormethiazide-200-mg-10ml-dexamethasone-5-mg-10ml-oral-paste-30ml-syringe/","Swollen legs in the horse can arise due to a variety of causes, some of which can be minor, while others can be a sign of more serious illness. Swelling may be present in one leg, only the hind legs, or in all four legs. In general, swelling tends to occur more readily in the hind legs, and has been referred to as “filling” or “stocking up.”1 Obviously, a horse’s legs are in the lower part of the body. Thus, due to gravity, fluid can build up within the tissues. This is known as edema, and can..."
"MELOXICAM 0.5 GM/SCOOP, ORAL POWDER, 100 SCOOPS (5CC SCOOP)","https://nexgenvetrx.com/meloxicam-0-5-gm-scoop-oral-powder-100-scoops-5cc-scoop/","Lameness is a general term used to describe abnormalities in a horse’s gait, usually in response to pain in a limb or some mechanical restriction on movement.1 The onset most commonly results from pain in the muscles, tendons, ligaments, bones, or joints which leads to abnormal movement at the walk, trot, or canter. Lameness accounts for significant losses within the equine industry, amounting to hundreds of millions of dollars annually.3 Lameness affects horses of all breeds. Unfortunately,..."
"FLUNIXIN MEGLUMINE 500 MG/SCOOP, ORAL POWDER, 120 SCOOPS (5CC SCOOP)","https://nexgenvetrx.com/flunixin-meglumine-500-mg-scoop-oral-powder-120-scoops-5cc-scoop/","In horses, healthy joints provide a frictionless system that allows ease of movement. Joints depend on the function of each of its components to serve this purpose in performance horses. Bone, articular cartilage, synovial fluid, synovial membranes, fibrous joint capsules, and ligamentous structures constitute these components.1 Even slight injuries in the horse can give rise to inflammation, and swelling is one of the most prevalent signs of inflammation, along with heat and pain. Observation..."
