"name","url","description"
"PHENYLBUTAZONE 20% INJECTION FOR HORSES, 100ML","https://nexgenvetrx.com/phenylbutazone-20-injection-for-horses-100ml/","Phenylbutazone is a non-steroidal anti-inflammatory drug. It also has analgesic (pain relieving) and antipyretic (fever-reducing) effects and is indicated for the treatment of a wide range of musculoskeletal disorders, including muscular sprain and strain, tendonitis, muscular overuse (including both muscular damage and strain/damage of the tendons attaching muscles to bone), arthritic conditions and acute joint injury/strain/sprain. FOR RX ONLY: A valid prescription from a licensed..."
"ACEPROMAZINE (ACEPROMAZINE MALEATE) INJECTION, 50ML","https://nexgenvetrx.com/acepromazine-acepromazine-maleate-injection-50ml/","Rapid acting preanesthetic and tranquilizer for dogs, cats and horses with a low order of toxicity. Administer IM, Sub-Q or IV. Can be used as an aid in controlling intractable animals during examination, treatment, grooming, x-ray and minor surgical procedures. FOR RX ONLY: A valid prescription from a licensed veterinarian is required for dispensing this medication."
"PROGESTERONE 200 MG/ML, INJECTION, 100ML","https://nexgenvetrx.com/progesterone-200-mg-ml-injection-100ml/","Progesterone For Equines It is quite common for horse owners and managers to require mares to enter into estrus and ovulate within a specific time period. This may be because they intend to use frozen semen to impregnate a mare, or because a stallion may be scheduled for delivery at a specific time to impregnate a mare. Since mares have been known to be unpredictable in the timing of their ovulation, this can lead to frustration and uncertainty on the part of the owner and attending..."
"MELOXICAM 20 MG/ML, INJECTABLE SOLUTION, 100ML","https://nexgenvetrx.com/meloxicam-20-mg-ml-injectable-solution-100ml/","Any abnormality in a horse's gait or stance is generally referred to as lameness. This can be caused by pain, a mechanical problem, or a neurological condition.1 Lameness most commonly results from pain in the muscles, tendons, ligaments, bones, or joints which leads to abnormal movement at the walk, trot, or canter. Lameness accounts for the greatest losses for the equine industry, amounting to hundreds of millions of dollars annually.3 Lameness affects horses of all kinds and at all levels...."
"FLUMETHASONE 0.5 MG/ML, INJECTABLE SOLUTION, 100ML","https://nexgenvetrx.com/flumethasone-0-5-mg-ml-injectable-solution-100ml/","When most people think about inflammation, they typically picture a localized area of swelling on a limb or around a wound. But inflammation often occurs systemically (affecting the whole body). Equine researchers have been studying the concept of systemic inflammation because of its links to a variety of health problems, including equine metabolic syndrome, insulin resistance, laminitis, leaky gut syndrome and risks for musculoskeletal injury.1 Systemic inflammation occurs when the body’s..."
"NALTREXONE HCL 50 MG/ML, INJECTABLE SOLUTION, 30ML","https://nexgenvetrx.com/naltrexone-hcl-50-mg-ml-injectable-solution-30ml/","Opioids are a class of drugs that include natural derivatives (e.g., illicit drugs such as heroin), synthetic opioids such as fentanyl and prescription pain relievers such as oxycodone, hydrocodone, codeine and morphine. Powerful opiates are essential tools for capturing and handling wild and exotic animals. Some characteristics of opioids include: The most potent drugs available for immobilization Specific antagonists readily available Reduced volume of drugs are typically required The only..."
"MKM™ (MEDETOMIDINE HCL 3.3 MG/ML + KETAMINE HCL 150 MG/ML + MIDAZOLAM HCL 5 MG/ML), INJECTABLE SOLUTION, 10ML","https://nexgenvetrx.com/medetomidine-hcl3.3-mg-ml-ketamine-hcl-133.3-mg-ml-midazolam-8.3-mg-ml-for-veterinary/","Midazolam is a benzodiazepine medication used for anesthesia, seizures, procedural sedation and agitation. In combination with medetomidine HCL (3.3 MG/ML) and ketamine HCL (150 MG/ML), the three provide a safe and gentler induction and excellent recovery results. The preferred route for the administration of an immobilizing drug by remote delivery is via intramuscular injection. The aim is to hit the animal in a specifically-selected site, causing injection into vascular tissue and..."
"ATIPAMEZOLE HCL 20 MG/ML, INJECTABLE SOLUTION, 30ML","https://nexgenvetrx.com/atipamezole-20-mg/ml-for-veterinary/","Specific and selective α2-adrenergic drugs are widely used in veterinary anesthesiology. Among these is atipamezole (atipamezole hydrochloride), a synthetic α2-adrenergic antagonist that was developed to reverse the actions of compounds such as medetomidine and dexmedetomidine. α2-adrenoceptor agonists such as clonidine and dexmedetomidine induce sedation, reduce anesthetic requirements, and improve perioperative hemodynamic and sympathoadrenal stability.1 Due to its efficacy compared to other..."
"XYLAZINE HCL 333 MG/ML, INJECTABLE SOLUTION, 100ML","https://nexgenvetrx.com/xylazine-hcl-333-mg-ml-injectable-solution-100ml/","Xylazine Veterinary Use Xylazine HCl is a non-narcotic compound that is commonly used as a sedative and analgesic, as well as a muscle relaxant. Xylazine has a long-standing use for surgical procedures in small animal practices, but it is also used in large animal and wildlife applications. In veterinary anesthesia, xylazine has often been used in combination with ketamine. The sedative and analgesic activity of xylazine is related to central nervous system depression. It provides muscle..."
"DETOMIDINE HCL 20 MG/ML, INJECTABLE SOLUTION, 10ML","https://nexgenvetrx.com/detomidine-hcl-20-mg-ml-injectable-solution-10ml/","Immobilization is necessary in order to safely perform surgical procedures on horses. In most cases, this is achieved through general anesthesia or through a combination of sedation and local anesthesia. Sedatives and anesthetics are powerful drugs which act on various organ systems including the brain, heart, blood vessels and lungs to achieve the desired effects. The interactions of these drugs with organs and systems are complex and sometimes unpredictable. Consequently, treatment with these..."
"ALBUTEROL SULFATE 5MG/ML, SOLUTION FOR INHALATION, 100ML","https://nexgenvetrx.com/albuterol-sulfate-5mg-ml-solution-for-inhalation-100ml/","Albuterol is used in horses for its effects on bronchial smooth muscle to alleviate bronchospasm or cough. Recurrent airway obstruction, often called heaves, results from environmental sensitivity to airborne particles (molds, pollen, mites), and can by exacerbated by stress. Exposure to foreign airborne particles can cause persistent airway inflammation. Albuterol (5 mg/ml) by NexGen works by relaxing the muscles of the airway to improve breathing. FOR RX ONLY: A valid prescription from a..."
"SODIUM HYALURONATE 10 MG/ML + AMIKACIN SULFATE 50 MG/ML, INJECTABLE SOLUTION, 10ML","https://nexgenvetrx.com/sodium-hyaluronate-10-mg-ml-amikacin-sulfate-50-mg-ml-injectable-solution-10ml/","Sodium hyaluronate is a glycosaminoglycan that is an important structural component of joint cartilage and is responsible for the viscosity of the synovial fluid in the joints. Amikacin is an aminoglycoside antibiotic that is used to treat serious gram-negative bacterial infections in horses, dogs, cats and other small animals. Sodium Hyaluronate 10 mg/ml / Amikacin 50 mg/ml injectable by NexGen helps manage horse joint health proactively by preventing the loss of hyaluronic acid as well as..."
"METHYLPREDNISOLONE ACETATE 40 MG/ML + AMIKACIN SULFATE 50 MG/ML, INJECTABLE SUSPENSION, 10ML","https://nexgenvetrx.com/methylprednisolone-acetate-40-mg-ml-amikacin-sulfate-50-mg-ml-injectable-suspension-10ml/","Methylprednisolone steroidal medication, specifically, a 6-methyl derivative of prednisolone and exceeds prenisolone in anti-inflammatory potency. It offers an advantage over older corticosteroids with the use of lower doses. Amikacin is an aminoglycoside antibiotic that is used to treat serious gram-negative bacterial infections in horses, dogs, cats and other small animals. Methylprednisolone 40 mg/ml / Amikacin 50 mg/ml injectable by NexGen is used to alleviate pain and lameness associated..."
"BUTORPHANOL TARTRATE 50 MG/ML, INJECTABLE SOLUTION, 10ML","https://nexgenvetrx.com/butorphanol-tartrate-50-mg-ml-injectable-solution-10ml/","Animals in the zoo setting are similar to domestic animals in the sense that they all require regular veterinary care. Some zoo animals may be examined without any sedation, while others require full sedation in order to be evaluated. General anesthesia poses risks for larger zoo species, such as cardiorespiratory depression, myopathy, and hyperthermia. In ruminants, ruminal bloat and regurgitation of rumen contents with potential aspiration pneumonia are added risks. 1 Thus, the use of heavy..."
"ALTRENOGEST 150 MG/ML, INJECTION, 10ML","https://nexgenvetrx.com/altrenogest-150-mg-ml-injection-10ml/","Altrenogest 150MG/ML for Equines Altrenogest is used to suppress estrus in mares in order to facilitate induction of normal estrous cycle activity. It is also used in mares to synchronize scheduled breeding activity, thus improving breeding efficiency. In the suppression of estrous behavior in mares, this is usually related to mares that are used as performance horses. Altrenogest is a progestin of the 19-nortestosterone group. As a veterinary medication, it is used extensively in the..."
"ALTRENOGEST 225 MG/ML, INJECTION, 10ML","https://nexgenvetrx.com/altrenogest-225-mg-ml-injection-10ml/","Altrenogest is effective in normally cycling mares for minimizing the necessity for estrus detection, for the synchronization of estrus, and permitting scheduled breeding. Estrus will begin 2-5 days after treatment is completed and most mares ovulate for between 8-15 days after withdrawal. Altrenogest is also effective in suppressing estrus expression in show mares or mares to be raced. Altrenogest has been demonstrated to maintain pregnancy in oophorectomized mares and may be of benefit in..."
"MKB™ (MEDETOMIDINE HCL 10 MG/ML + KETAMINE HCL 50 MG/ML + BUTORPHANOL TARTRATE 25 MG/ML), INJECTABLE SOLUTION, 10ML","https://nexgenvetrx.com/mkb-medetomidine-hcl-10-mg-ml-ketamine-hcl-50-mg-ml-butorphanol-tartrate-25-mg-ml-injectable-solution-10ml/","Butorphanol tartrate is a synthetically derived opioid agonist-antagonist analgesic of the phenanthrene series, with a potency of about four to seven times that of morphine. In combination with medetomidine HCL (10 MG/ML) and ketamine HCL (50 MG/ML), the three provide a safe and gentler induction and excellent recovery results. By using the MKB™ kit from NexGen Pharmaceuticals, wildlife handlers are able to induce a reversible sedation, with inductions times ranging from 3 to 5 minutes and..."
"AMMONIUM SULFATE 7.5 MG/ML, INJECTABLE SOLUTION, 100ML","https://nexgenvetrx.com/ammonium-sulfate-7-5-mg-ml-injectable-solution-100ml/","Ammonium sulfate is commonly prescribed for urine acidification in horses, as acidification of the urine can help prevent equine urolithiasis (upper urinary tract or bladder stones). Bladder stones are most commonly seen in adult horses, but can occur at any age. Male horses (and geldings in particular) make up 75% of all cases of bladder stones which are generally attributed to a longer urethra which prevents stone clearance.1 Bladder stones (uroliths) form when urinary crystals precipitate..."
"CALCIUM LEVULINATE 20%, INJECTABLE SOLUTION, 100ML","https://nexgenvetrx.com/calcium-levulinate-20-injectable-solution-100ml/","Minerals are involved in numerous functions in the horse’s body, including the function of enzymes, structural components, energy transfer and acid-base balance. Minerals are also components of vitamins, amino acids, and hormones. The minerals that are needed in the largest quantities by horses are referred to as macro-minerals.1 These include calcium (Ca), phosphorous (P), magnesium (Mg), potassium (K), sodium (Na) and chloride (Cl). The skeleton accounts for 99% of the calcium in a horse’s..."
"TOLAZOLINE HCL 200 MG/ML, INJECTABLE SOLUTION, 30ML","https://nexgenvetrx.com/tolazoline-hcl-200-mg-ml-injectable-solution-30ml/","Tolazoline (tolazoline HCl) is part of the synthetic group of α-adrenergic blocking agents known as imidazoline derivatives. It reverses the analgesic effects of α-agonists. Tolazoline also antagonizes the effects of detomidine, speeds recovery and longer-lasting than atipamezole.1 Tolazoline’s Effects Tolazoline is fast-acting (usually within 5 minutes of IV administration), but may not fully reverse the effects of sedation or heart rate/rhythm. Its duration of action is relatively short,..."
"XYLAZINE HCL 300 MG/ML, INJECTABLE SOLUTION, 30ML","https://nexgenvetrx.com/xylazine-hcl-300-mg-ml-injectable-solution-30ml/","Xylazine (Xylazine HCl) is an alpha-2-adrenergic agonist (α2- adrenergic agonist) that is used as a sedative and analgesic agent in a variety of species, as well as an emetic in cats. Xylazine has a long-standing use for surgical procedures in small animal practices, but it is also used in large animal and wildlife applications. In veterinary anesthesia, xylazine is often used in combination with ketamine. The sedative and analgesic activity of xylazine is related to central nervous system..."
"XYLAZINE HCL 200 MG/ML, INJECTABLE SOLUTION, 100ML","https://nexgenvetrx.com/xylazine-hcl-200-mg-ml-injectable-solution-100ml/","Xylazine (Xylazine HCl) is an alpha-2-adrenergic agonist (α2- adrenergic agonist). In veterinary medicine, xylazine is often used in combination with ketamine. Xylazine provides muscle relaxation based on inhibition of the intraneural transmission of impulses in the central nervous system.2 The degree of CNS inhibition facilitates xylazine providing dose-dependent, deep muscle relaxation and respiratory depression without inhibition of the nervous system’s more critical functions. In 1981,..."
"ESTRONE 10 MG/ML, INJECTABLE SUSPENSION, 100ML","https://nexgenvetrx.com/estrone-10-mg-ml-injectable-suspension-100ml/","The determination of whether or not a mare is in foal is based on normal physiological events that occur during her pregnancy. There are a variety of techniques available to help veterinarians tell if a mare is pregnant, all of which have limitations associated with them and may give rise to either false positive or false negative results. Mares have been known to be notoriously irregular in their cycling, making the early determination of pregnancy difficult. Horse owners and breeding..."
"FLUTICASONE PROPIONATE 2 MG/ML + AMIKACIN SULFATE 50 MG/ML, INJECTABLE SUSPENSION, 10ML","https://nexgenvetrx.com/fluticasone-propionate-2-mg-ml-amikacin-sulfate-50-mg-ml-injectable-suspension-10ml/","Amikacin is an aminoglycoside antibiotic that is used to treat serious gram-negative bacterial infections in horses, dogs, cats and other small animals. In particular, the effectiveness of Amikacin in infections caused by Escherichia coli, Pseudomonas sp, and Klebsiella sp has been demonstrated clinically in the horse. In horses with severe RAO, treatment with fluticasone for 2 weeks resulted in significantly greater improvement in pulmonary function, compared with pulmonary function after..."
"FLUOXETINE 32 MG/ML, INJECTABLE SOLUTION, 50ML","https://nexgenvetrx.com/fluoxetine-32-mg-ml-injectable-solution-50ml/","Apart from manifestations related to the cycle in mares and breeding-related aggression, a variety of behavior problems can occur in horses. Some of the most common are aggression (including aggression towards people), fear, performance problems (e.g., bucking), abnormal eating habits and undesirable stall behaviors.1 Some potential causes of behavioral problems in horses can include: Gastric ulcers Soreness Conflict behaviors (inconsistent training methods and cues) Thermoregulation problems..."
"MULTIMIN 90 CHELATED AQUEOUS SUPPLEMENT INJECTION, 500ML","https://nexgenvetrx.com/multimin-90-chelated-aqueous-supplement-injection-500ml/","FOR RX ONLY: A valid prescription from a licensed veterinarian is required for dispensing this medication."
"BAYTRIL 100 (ENROFLOXACIN) ANTIMICROBIAL INJECTABLE SOLUTION 250ML","https://nexgenvetrx.com/baytril-100-enrofloxacin-antimicrobial-injectable-solution-250ml/","FOR RX ONLY: A valid prescription from a licensed veterinarian is required for dispensing this medication."
"MEDROXYPROGESTERONE 200 MG/ML, INJECTABLE SUSPENSION, 100ML","https://nexgenvetrx.com/medroxyprogesterone-200-mg-ml-injectable-suspension-100ml/","Mare are seasonally polyestrus, which means they have an anovulatory period during the short light days of late fall and early winter, and begin to ovulate as the days become longer beginning in the spring. The sexual behavior of the mare probably evolved in the social context of family groups that typically consist of multiple adult mares and their young offspring, plus one or more adult stallions.1 Behavior that identifies mares as being estrous or non-estrous status has been grouped into..."
"ESTRUMATE (CLOPROSTENOL SODIUM) INJECTION, PROSTAGLANDIN ANALOGUE, 20ML","https://nexgenvetrx.com/estrumate-cloprostenol-sodium-injection-prostaglandin-analogue-20ml/","FOR RX ONLY: A valid prescription from a licensed veterinarian is required for dispensing this medication."
"LUTALYSE (DINOPROST TROMETHAMINE) INJECTION 5MG/ML, 30ML","https://nexgenvetrx.com/lutalyse-dinoprost-tromethamine-injection-5mg-ml-30ml/","FOR RX ONLY: A valid prescription from a licensed veterinarian is required for dispensing this medication."
"ADRENOCORTICOTROPIC HORMONE (ACTH) 80 IU, INJECTION, 10ML","https://nexgenvetrx.com/adrenocorticotropic-hormone-acth-80-iu-injection-10ml/","Adrenocorticotropic Hormone (ACTH) is a polypeptide tropic hormone produced by and secreted by the anterior pituitary gland. The hormone is an adrenal gland stimulant that is administered to secrete large amounts of cortisol into the bloodstream. In addition to steroidogenic enzymes, ACTH also enhances transcription of the mitochondrial genes that encode for subunits of mitochondrial oxidative phosphorylation systems. These actions may actually be necessary to supply the enhanced energy needs..."
"ESTRUMATE (CLOPROSTENOL SODIUM) INJECTION, PROSTAGLANDIN ANALOGUE, 100ML","https://nexgenvetrx.com/estrumate-cloprostenol-sodium-injection-prostaglandin-analogue-100ml/","FOR RX ONLY: A valid prescription from a licensed veterinarian is required for dispensing this medication."
"BANAMINE (FLUNIXIN MEGLUMINE) INJECTABLE SOLUTION, STERILE, 100ML","https://nexgenvetrx.com/banamine-flunixin-meglumine-injectable-solution-sterile-100ml/","Flunixin meglumine 50 mg/mL for IV or IM use in horses and IV use in beef and dairy cattle. Not for use in dry dairy cows and veal calves. FOR RX ONLY: A valid prescription from a licensed veterinarian is required for dispensing this medication."
"BANAMINE (FLUNIXIN MEGLUMINE) INJECTABLE SOLUTION, STERILE, 250ML","https://nexgenvetrx.com/banamine-flunixin-meglumine-injectable-solution-sterile-250ml/","Flunixin meglumine 50 mg/mL for IV or IM use in horses and IV use in beef and dairy cattle. Not for use in dry dairy cows and veal calves. FOR RX ONLY: A valid prescription from a licensed veterinarian is required for dispensing this medication."
"AMINO ACIDS VITAMIN CONCENTRATE, INJECTABLE SOLUTION, 500ML","https://nexgenvetrx.com/amino-acids-vitamin-concentrate-injectable-solution-500ml/","FOR RX ONLY: A valid prescription from a licensed veterinarian is required for dispensing this medication."
"FLUTICASONE PROPIONATE 2 MG/ML, INJECTABLE SOLUTION, 10ML","https://nexgenvetrx.com/fluticasone-propionate-2-mg-ml-injectable-solution-10ml/","Heaves is a chronic, non-infectious airway condition that affects horses. Also called recurrent airway obstruction or RAO, the condition usually occurs in horses over 6 years of age.1 Some other names for conditions presenting with similar symptoms include inflammatory airway disease (IAD), chronic bronchitis, allergic airway disease and small airway disease. These conditions were formerly referenced as chronic obstructive pulmonary disease or COPD; this is not to be confused with COPD in..."
"FOLIC ACID 50 MG/ML, INJECTABLE SOLUTION, 100ML","https://nexgenvetrx.com/folic-acid-50-mg-ml-injectable-solution-100ml/","Equine protozoal myeloencephalitis (EPM) is a central nervous system (CNS) disease of horses that can be caused by either of the protozoa Sarcocystis neurona or Neospora hughesi,1 although the majority of cases are caused by the former. EPM can result in devastating neurologic disease, and a small percentage of exposed horses will develop EPM after ingesting feed or water contaminated with the protozoa. EPM has been reported in most of the contiguous 48 states of the USA, southern Canada,..."
"MEDETOMIDINE HCL 10 MG/ML, INJECTABLE SOLUTION, 10ML","https://nexgenvetrx.com/medetomidine-hcl-10-mg-ml-injectable-solution-10ml/","Many procedures that are routinely accomplished in domestic animals with minimal restraint require anesthesia for the welfare and safety of both the zoo animal and veterinarian. Therefore, the chemical immobilization of wild and exotic animals in the zoo setting (as opposed to in the field) is essentially a form of veterinary anesthesia conducted under substantially more difficult circumstances than in a practice setting.1 Situationally, the chemical immobilization of zoo animals involves far..."
"CARNITINE (L) 200 MG/ML, INJECTABLE SOLUTION, 100ML","https://nexgenvetrx.com/carnitine-l-200-mg-ml-injectable-solution-100ml/","FOR RX ONLY: A valid prescription from a licensed veterinarian is required for dispensing this medication."
"MEDETOMIDINE HCL 40 MG/ML, INJECTABLE SOLUTION, 10ML","https://nexgenvetrx.com/medetomidine-hcl-40-mg-ml-injectable-solution-10ml/","Oftentimes, procedures that are routinely accomplished in companion animals with minimal restraint require sedation or anesthesia for exotic species, whether in the veterinary small animal practice, zoos or in the field.1 The chemical immobilization of captive exotic animals involves far more control and predictability of the environment than sedating or anesthetizing the same animals in the field, but it still requires an abundance of caution and planning, as well as the requisite skills and..."
"DETOMIDINE HCL 5 MG/ML, INJECTABLE SOLUTION, 20ML","https://nexgenvetrx.com/detomidine-hcl-5-mg-ml-injectable-solution-20ml/","There are a wide range of circumstances in which equine veterinarians will employ sedation or anesthesia in horses. In general, sedation is used to make horses more acquiescent when stressful procedures are being performed on them, or to reduce responses to a level where invasive surgical procedures may be performed (general anesthesia). Horses are routinely sedated in the equine veterinary practice; apart from vaccinations, it is probably the most routine procedure performed by equine..."
"SODIUM SALICYLATE 200 MG/ML, INJECTABLE SOLUTION, 100ML","https://nexgenvetrx.com/sodium-salicylate-200-mg-ml-injectable-solution-100ml/","Signs of acute pain in horses caused by conditions such as colic and lameness are familiar to horse owners and managers however, horses can experience mild discomfort or moderate pain and show only subtle signs. Veterinarians agree that horses experiencing even minor pain should be treated. While recognizing pain in horses is important, it is also important to understand that the pain horses cannot be evaluated on the same scale as those humans use as a frame of reference.1 Changes in behavior..."
"ATIPAMEZOLE HCL 40 MG/ML, INJECTABLE SOLUTION, 30ML","https://nexgenvetrx.com/atipamezole-hcl-40-mg-ml-injectable-solution-30ml/","Atipamezole (atipamezole hydrochloride, 40mg/ml) by NexGen is a synthetic α2-adrenergic antagonist. Developed to reverse the actions of compounds such as medetomidine and dexmedetomidine, Atipamezole for veterinary use safely and reliably reverses the effects of these compounds and is widely used in small and large animal practices, as well as in wildlife applications, such as deer. FOR RX ONLY: A valid prescription from a licensed veterinarian is required for dispensing this medication."
"YOHIMBINE HCL 10 MG/ML, INJECTABLE SOLUTION, 30ML","https://nexgenvetrx.com/yohimbine-hcl-10-mg-ml-injectable-solution-30ml/","Reversal agents encompass any drug used to reverse the effects of anesthetics, narcotics or potentially toxic agents. Also known as antagonists, these drugs are widely used in modern veterinary anesthesia. They are effective tools for facilitating better control of the effects and side effects of drugs routinely used in sedation and anesthesia.1 In mode of action, Agonists are drugs that bind to a cell’s receptor, producing a desired response. Antagonists are drugs that bind to the receptor..."
"ARGININE (L) 100 MG/ML, INJECTABLE SOLUTION, 100ML","https://nexgenvetrx.com/arginine-l-100-mg-ml-injectable-solution-100ml/","L-Arginine is a potent nitric oxide enhancer and causes vasodilation of both smooth and skeletal muscles. It is often used in cases of colic to help reduce spasms and ischemia of the vascular areas of the intestines. It also works well to dilate the vessels of the skeletal muscles, thus providing more blood flow. L-Arginine is also extremely useful when treating “bleeders” because it reduces resistance to the blood flow through the lungs. FOR RX ONLY: A valid prescription from a licensed..."
